Cites,Authors,Title,Year,Source,Publisher,ArticleURL,CitesURL,GSRank,QueryDate,Type,DOI,ISSN,CitationURL,Volume,Issue,StartPage,EndPage,ECC,CitesPerYear,CitesPerAuthor,AuthorCount,Age,Abstract,FullTextURL,RelatedURL
3,"AA Tavakoly, CH David, JL Gutenson, MW Wahl…","Development of non-data driven reservoir routing in the routing application for parallel computatIon of discharge (RAPID) model",2023,"… Modelling &Software","Elsevier","https://www.sciencedirect.com/science/article/pii/S1364815223000178","https://scholar.google.com/scholar?cites=11728118199581133247&as_sdt=2005&sciodt=0,5&hl=en",163,"2025-05-02 22:58:21","","","","",,,,,3,1.50,1,5,2,"Dams and reservoirs predictably alter the discharge of a river often confounding large-scale flow simulations. The Routing Application for Parallel computatIon of Discharge (RAPID) …","https://www.sciencedirect.com/science/article/am/pii/S1364815223000178","https://scholar.google.com/scholar?q=related:v8nTQV2lwqIJ:scholar.google.com/&scioq=&hl=en&as_sdt=2005&sciodt=0,5"
16,"H Habibi, AR Nasab, A Norouzi, B Nazari…","High resolution flash flood forecasting for the Dallas-Fort Worth metroplex",2016,"Journal of Water …","researchgate.net","https://www.researchgate.net/profile/Hamideh-Habibi/publication/297420302_High_Resolution_Flash_Flood_Forecasting_for_the_Dallas-Fort_Worth_Metroplex/links/5a5f767e0f7e9b964a1cc1b6/High-Resolution-Flash-Flood-Forecasting-for-the-Dallas-Fort-Worth-Metroplex.pdf","https://scholar.google.com/scholar?cites=16555022503031725319&as_sdt=2005&sciodt=0,5&hl=en",164,"2025-05-02 22:58:21","PDF","","","",,,,,16,1.78,3,5,9,"Urban flash flooding is a serious problem in large highly populated areas such as the Dallas–Fort Worth metroplex (DFW). Being able to monitor and predict flash flooding at a high …","https://www.researchgate.net/profile/Hamideh-Habibi/publication/297420302_High_Resolution_Flash_Flood_Forecasting_for_the_Dallas-Fort_Worth_Metroplex/links/5a5f767e0f7e9b964a1cc1b6/High-Resolution-Flash-Flood-Forecasting-for-the-Dallas-Fort-Worth-Metroplex.pdf","https://scholar.google.com/scholar?q=related:B93NFUFBv-UJ:scholar.google.com/&scioq=&hl=en&as_sdt=2005&sciodt=0,5"
3,"H Barkhordari, M Nasseri, H Rezazadeh","Possibility of global gridded streamflow dataset correction: applications of large-scale watersheds with different climates",2023,"Theoretical and Applied …","Springer","https://link.springer.com/article/10.1007/s00704-023-04388-2","https://scholar.google.com/scholar?cites=6612565938878231508&as_sdt=2005&sciodt=0,5&hl=en",165,"2025-05-02 22:58:21","","10.1007/s00704-023-04388-2","","",,,,,3,1.50,1,3,2,"Previous studies depicted that the global gridded hydroclimatic products mostly lack precision and are inconsistent throughout the real-world water cycle. The current study …","","https://scholar.google.com/scholar?q=related:1DOvwK-NxFsJ:scholar.google.com/&scioq=&hl=en&as_sdt=2005&sciodt=0,5"
3,"A Srivastava, SA Rao, S Ghosh","Impact of riverine fresh water on Indian summer monsoon: coupling a runoff routing model to a global seasonal forecast model",2022,"Frontiers in Climate","frontiersin.org","https://www.frontiersin.org/articles/10.3389/fclim.2022.902586/full","https://scholar.google.com/scholar?cites=1028963810149386917&as_sdt=2005&sciodt=0,5&hl=en",166,"2025-05-02 22:58:21","HTML","10.3389/fclim.2022.902586","","",,,,,3,1.00,1,3,3,"Rivers form an essential component of the earth system, with~ 36,000 km3 of riverine freshwater being dumped into the global oceans every year. The role of rivers in controlling …","https://www.frontiersin.org/articles/10.3389/fclim.2022.902586/full","https://scholar.google.com/scholar?q=related:pcqvNiKdRw4J:scholar.google.com/&scioq=&hl=en&as_sdt=2005&sciodt=0,5"
0,"A Ouazad, ME Kahn","Time Consistent Infrastructure Investments: Optimal Flood Protection Policies in Spatial Equilibrium",2025,"","nber.org","https://www.nber.org/papers/w33333","",167,"2025-05-02 22:58:21","","","","",,,,,0,0.00,0,2,1,"Place-based investments can have unintended general equilibrium effects and face challenges of time inconsistency. This paper simulates the granular impact of alternative …","https://www.nber.org/system/files/working_papers/w33333/w33333.pdf","https://scholar.google.com/scholar?q=related:ZwvZcg1txsMJ:scholar.google.com/&scioq=&hl=en&as_sdt=2005&sciodt=0,5"
3,"AM Khalifa","Development and Applications of Morphodynamic Model to Study Deltaic and Coastal Ecosystems",2023,"","search.proquest.com","https://search.proquest.com/openview/5d1bb78376dc06ac9ad6e851ba98063c/1?pq-origsite=gscholar&cbl=18750&diss=y","https://scholar.google.com/scholar?cites=15758952036276427184&as_sdt=2005&sciodt=0,5&hl=en",168,"2025-05-02 22:58:21","","","","",,,,,3,1.50,3,1,2,"Many coastal regions around the globe experience land loss due to high relative sea level rise rates, declining sediment supply, and a host of other anthropogenic factors. Of particular …","","https://scholar.google.com/scholar?q=related:sNms6mELs9oJ:scholar.google.com/&scioq=&hl=en&as_sdt=2005&sciodt=0,5"
16,"V Häfliger, E Martin, A Boone, F Habets…","Evaluation of regional-scale river depth simulations using various routing schemes within a hydrometeorological modeling framework for the preparation of …",2015,"Journal of …","journals.ametsoc.org","https://journals.ametsoc.org/view/journals/hydr/16/4/jhm-d-14-0107_1.xml","https://scholar.google.com/scholar?cites=12446377209339086666&as_sdt=2005&sciodt=0,5&hl=en",169,"2025-05-02 22:58:21","HTML","","","",,,,,16,1.60,3,5,10,"Abstract The Surface Water and Ocean Topography (SWOT) mission will provide free water surface elevations, slopes, and river widths for rivers wider than 50 m. Models must be …","https://journals.ametsoc.org/view/journals/hydr/16/4/jhm-d-14-0107_1.xml","https://scholar.google.com/scholar?q=related:SocszyBquqwJ:scholar.google.com/&scioq=&hl=en&as_sdt=2005&sciodt=0,5"
13,"M ElSaadani, WF Krajewski","A time-based framework for evaluating hydrologic routing methodologies using wavelet transform",2017,"Journal of Water Resource and Protection","scirp.org","https://www.scirp.org/journal/paperinformation?paperid=76780","https://scholar.google.com/scholar?cites=10665598446209436747&as_sdt=2005&sciodt=0,5&hl=en",170,"2025-05-02 22:58:21","HTML","","","",,,,,13,1.63,7,2,8,"In this study we explore a method which provides an insight into the effectiveness of various hydrologic models' routing components based on their ability to accurately represent flood …","https://www.scirp.org/journal/paperinformation?paperid=76780","https://scholar.google.com/scholar?q=related:S4xFL0fRA5QJ:scholar.google.com/&scioq=&hl=en&as_sdt=2005&sciodt=0,5"
8,"T Gan, DG Tarboton, JS Horsburgh, P Dash…","Collaborative sharing of multidimensional space-time data in a next generation hydrologic information system",2020,"… Modelling &Software","Elsevier","https://www.sciencedirect.com/science/article/pii/S1364815219308977","https://scholar.google.com/scholar?cites=9786309233153096217&as_sdt=2005&sciodt=0,5&hl=en",171,"2025-05-02 22:58:21","","","","",,,,,8,1.60,2,5,5,"In hydrologic research, there is a need to manage, archive, and publish data in a discoverable way to increase data reuse, transparency, and reproducibility …","https://www.sciencedirect.com/science/article/am/pii/S1364815219308977","https://scholar.google.com/scholar?q=related:GTo3wGX0z4cJ:scholar.google.com/&scioq=&hl=en&as_sdt=2005&sciodt=0,5"
13,"TR Petty, N Noman, D Ding, JB Gongwer","Flood forecasting GIS water-flow visualization enhancement (WaVE): A case study",2016,"Journal of Geographic …","scirp.org","https://www.scirp.org/html/3-8401669_72935.htm","https://scholar.google.com/scholar?cites=7466983895018839080&as_sdt=2005&sciodt=0,5&hl=en",172,"2025-05-02 22:58:21","HTML","","","",,,,,13,1.44,3,4,9,"Riverine flood event situation awareness and emergency management decision support systems require accurate and scalable geoanalytic data at the local level. This paper …","https://www.scirp.org/html/3-8401669_72935.htm","https://scholar.google.com/scholar?q=related:KBwpbkoOoGcJ:scholar.google.com/&scioq=&hl=en&as_sdt=2005&sciodt=0,5"
13,"JF Perez, NR Swain, HG Dolder…","From Global to Local: Providing Actionable Flood Forecast Information in a Cloud‐Based Computing Environment",2016,"JAWRA Journal of …","Wiley Online Library","https://onlinelibrary.wiley.com/doi/abs/10.1111/1752-1688.12392","https://scholar.google.com/scholar?cites=14789937557984524222&as_sdt=2005&sciodt=0,5&hl=en",173,"2025-05-02 22:58:21","","10.1111/1752-1688.12392","","",,,,,13,1.44,3,4,9,"Global and continental scale flood forecast provide coarse resolution flood forecast, but from the perspective of emergency management, flood warnings should be detailed and specific …","https://onlinelibrary.wiley.com/doi/am-pdf/10.1111/1752-1688.12392","https://scholar.google.com/scholar?q=related:vjfgOdlpQM0J:scholar.google.com/&scioq=&hl=en&as_sdt=2005&sciodt=0,5"
8,"MS Sikder, M Bonnema, CM Emery…","A synthetic data set inspired by satellite altimetry and impacts of sampling on global spaceborne discharge characterization",2021,"Water Resources …","Wiley Online Library","https://agupubs.onlinelibrary.wiley.com/doi/abs/10.1029/2020WR029035","https://scholar.google.com/scholar?cites=1737932731018413167&as_sdt=2005&sciodt=0,5&hl=en",174,"2025-05-02 22:58:21","","10.1029/2020WR029035","","",,,,,8,2.00,2,4,4,"Despite being a critical component of Earth's water cycle, much remains unknown about freshwater fluxes in the world's rivers. Discharge can be estimated in situ by monitoring …","https://agupubs.onlinelibrary.wiley.com/doi/pdf/10.1029/2020WR029035","https://scholar.google.com/scholar?q=related:b4TgY5xgHhgJ:scholar.google.com/&scioq=&hl=en&as_sdt=2005&sciodt=0,5"
2,"S Nandi, M Janga Reddy","Evaluating the performance of bias-corrected IMERG satellite rainfall estimates for hydrological simulation over the Upper Bhima River basin, India",2022,"Geocarto International","Taylor &Francis","https://www.tandfonline.com/doi/abs/10.1080/10106049.2022.2101695","https://scholar.google.com/scholar?cites=1958582015545243609&as_sdt=2005&sciodt=0,5&hl=en",175,"2025-05-02 22:58:21","","10.1080/10106049.2022.2101695","","",,,,,2,0.67,1,2,3,"In this study, the performance and hydrological utility of IMERG rainfall estimates over the Upper Bhima River basin, India, are comprehensively evaluated using a VIC-RAPID …","","https://scholar.google.com/scholar?q=related:2fcKVPdHLhsJ:scholar.google.com/&scioq=&hl=en&as_sdt=2005&sciodt=0,5"
1,"DR Harp, AS Orlando, E Hohn, A Sood…","Prioritizing Irrigation‐System Upgrades to Maximize Improvements to Agricultural Drain‐Network Water Quality: A Graph‐Theoretic Approach",2023,"Water Resources …","Wiley Online Library","https://agupubs.onlinelibrary.wiley.com/doi/abs/10.1029/2022WR033285","https://scholar.google.com/scholar?cites=1987348989610141937&as_sdt=2005&sciodt=0,5&hl=en",176,"2025-05-02 22:58:21","","10.1029/2022WR033285","","",,,,,1,0.50,0,5,2,"We develop and demonstrate an approach to optimally prioritize fields for irrigation‐system upgrades to improve agricultural‐drain discharge water quality. The approach accounts for …","https://agupubs.onlinelibrary.wiley.com/doi/pdf/10.1029/2022WR033285","https://scholar.google.com/scholar?q=related:8ahxamB7lBsJ:scholar.google.com/&scioq=&hl=en&as_sdt=2005&sciodt=0,5"
3,"NP Memarsadeghi, S Rowan, AW Sisco…","Enhancing resilience: Integrating future flood modeling and socio-economic analysis in the face of climate change impacts",2024,"Science of The Total …","Elsevier","https://www.sciencedirect.com/science/article/pii/S0048969724050435","https://scholar.google.com/scholar?cites=17495920014225593720&as_sdt=2005&sciodt=0,5&hl=en",177,"2025-05-02 22:58:21","","","","",,,,,3,3.00,1,4,1,"As climate change intensifies, future floods will become more severe in some areas with geographic variation, necessitating that local and regional governments implement systems …","","https://scholar.google.com/scholar?q=related:eFWQOo7-zfIJ:scholar.google.com/&scioq=&hl=en&as_sdt=2005&sciodt=0,5"
10,"V Häfliger, E Martin, A Boone, S Ricci, S Biancamaria","Assimilation of synthetic SWOT river depths in a regional hydrometeorological model",2019,"Water","mdpi.com","https://www.mdpi.com/2073-4441/11/1/78","https://scholar.google.com/scholar?cites=3792275455347649298&as_sdt=2005&sciodt=0,5&hl=en",178,"2025-05-02 22:58:21","HTML","","","",,,,,10,1.67,2,5,6,"The SWOT (Surface Water and Ocean Topography) mission, to be launched in 2021, will provide water surface elevations, slopes, and river width measurements for rivers wider than …","https://www.mdpi.com/2073-4441/11/1/78","https://scholar.google.com/scholar?q=related:EuttLm_eoDQJ:scholar.google.com/&scioq=&hl=en&as_sdt=2005&sciodt=0,5"
9,"JL Gutenson, ML Follum, AD Snow…","Large-scale flood inundation modeling in data sparse environments using TanDEM-X terrain data",2017,"Open Water …","scholarsarchive.byu.edu","https://scholarsarchive.byu.edu/openwater/vol4/iss2/4/","https://scholar.google.com/scholar?cites=4060903494681324273&as_sdt=2005&sciodt=0,5&hl=en",179,"2025-05-02 22:58:21","","","","",,,,,9,1.13,2,4,8,"This paper demonstrates a workflow used by the US Army Coastal and Hydraulics Laboratory to quickly generate high-resolution flood inundation maps nearly anywhere in …","https://scholarsarchive.byu.edu/cgi/viewcontent.cgi?article=1093&context=openwater","https://scholar.google.com/scholar?q=related:8WqfezY6WzgJ:scholar.google.com/&scioq=&hl=en&as_sdt=2005&sciodt=0,5"
7,"A Meyer, JL Sánchez Lozano, J Nelson…","Connecting space to village by predicting algae contamination in Lake Atitlán, Guatemala",2021,"Open Water …","scholarsarchive.byu.edu","https://scholarsarchive.byu.edu/openwater/vol7/iss1/8/","https://scholar.google.com/scholar?cites=4237327952220010084&as_sdt=2005&sciodt=0,5&hl=en",180,"2025-05-02 22:58:21","","","","",,,,,7,1.75,2,4,4,"Environmental authorities in Guatemala have become increasingly concerned in the last decade due to the deteriorating condition of the Lake Atitlán watershed. The lake has …","https://scholarsarchive.byu.edu/cgi/viewcontent.cgi?article=1113&context=openwater","https://scholar.google.com/scholar?q=related:ZDbofFIDzjoJ:scholar.google.com/&scioq=&hl=en&as_sdt=2005&sciodt=0,5"
0,"C Qin, Y Zeng, Y Zhao…","Recalibration of Neural Networks Using Transfer Learning for Streamflow Forecasting",2024,"… and Information in …","asmedigitalcollection.asme.org","https://asmedigitalcollection.asme.org/IDETC-CIE/proceedings-abstract/IDETC-CIE2024/88360/1208824","",181,"2025-05-02 22:58:21","","","","",,,,,0,0.00,0,4,1,"Streamflow forecasting is a critical component in the design of resilient civil infrastructure, especially when considering extreme events related to river flows, such as flooding. While …","","https://scholar.google.com/scholar?q=related:G8etOSC7lAwJ:scholar.google.com/&scioq=&hl=en&as_sdt=2005&sciodt=0,5"
2,"M Han","Improving hydrological process representation in lake and forest dominated watersheds",2022,"","uwspace.uwaterloo.ca","https://uwspace.uwaterloo.ca/handle/10012/18441","https://scholar.google.com/scholar?cites=7588110656434341202&as_sdt=2005&sciodt=0,5&hl=en",182,"2025-05-02 22:58:21","","","","",,,,,2,0.67,2,1,3,"Hydrological models are simplified representations of the natural surface water dynamic system. This thesis focuses on improving these representations to make them more realistic …","https://uwspace.uwaterloo.ca/bitstream/handle/10012/18441/Han_Ming.pdf?sequence=7","https://scholar.google.com/scholar?q=related:UgUgQXBiTmkJ:scholar.google.com/&scioq=&hl=en&as_sdt=2005&sciodt=0,5"
0,"D Rojas-Lesmes, J Sanchez-Lozano, EJ Nelson…","National Water Level Forecast (NWLF): An Open-Source Customizable Web Application for the GEOGLOWS ECMWF Global Hydrological Model",2025,"Information …","Elsevier","https://www.sciencedirect.com/science/article/pii/S3050520825000089","",183,"2025-05-02 22:58:21","HTML","","","",,,,,0,0.00,0,4,1,"Water-related disasters, including floods and droughts, require innovative forecasting tools for effective risk management and decision-making. The National Water Level Forecast …","https://www.sciencedirect.com/science/article/pii/S3050520825000089","https://scholar.google.com/scholar?q=related:vQADtVgrGHYJ:scholar.google.com/&scioq=&hl=en&as_sdt=2005&sciodt=0,5"
8,"DH Kim","High-spatial-resolution streamflow estimation at ungauged river sites or gauged sites with missing data using the National Hydrography Dataset (NHD) and US …",2018,"Journal of Hydrology","Elsevier","https://www.sciencedirect.com/science/article/pii/S0022169418306796","https://scholar.google.com/scholar?cites=8689382393220366410&as_sdt=2005&sciodt=0,5&hl=en",184,"2025-05-02 22:58:21","","","","",,,,,8,1.14,8,1,7,"The need for a method of estimating streamflow with both high-quality and high spatial resolution, particularly for ungauged sites, is critical under current circumstances …","","https://scholar.google.com/scholar?q=related:SgBvkT_jlngJ:scholar.google.com/&scioq=&hl=en&as_sdt=2005&sciodt=0,5"
1,"O Cenobio Cruz","Advancing hydrological modeling for understanding drought dynamics in the Ebro river basin. The role of Land Surface Models in coupled natural-human …",2023,"","Universitat Ramon Llull","","https://scholar.google.com/scholar?cites=15090544269333579939&as_sdt=2005&sciodt=0,5&hl=en",185,"2025-05-02 22:58:21","CITATION","","","",,,,,1,0.50,1,1,2,"","","https://scholar.google.com/scholar?q=related:o0jvUA9ibNEJ:scholar.google.com/&scioq=&hl=en&as_sdt=2005&sciodt=0,5"
5,"JL Gutenson, AA Tavakoly, TC Massey…","Investigating modeling strategies to couple inland hydrology and coastal hydraulics to better understand compound flood risk",2021,"… and Water Resources …","ascelibrary.org","https://ascelibrary.org/doi/abs/10.1061/9780784483466.006","https://scholar.google.com/scholar?cites=12192230250756181176&as_sdt=2005&sciodt=0,5&hl=en",186,"2025-05-02 22:58:21","","10.1061/9780784483466.006","","",,,,,5,1.25,1,4,4,"In coastal and estuarine environments, runoff from the inland merges with ocean waters. During tropical storms or heavy rainfall events, the combination of fresh and brackish water …","","https://scholar.google.com/scholar?q=related:uAwY3NCAM6kJ:scholar.google.com/&scioq=&hl=en&as_sdt=2005&sciodt=0,5"
6,"G Amatulli, S Domisch, J Kiesel, T Sethi, D Yamazaki…","High-resolution stream network delineation using digital elevation models: assessing the spatial accuracy",2018,"","peerj.com","https://peerj.com/preprints/27109/","https://scholar.google.com/scholar?cites=2393219006279679155&as_sdt=2005&sciodt=0,5&hl=en",187,"2025-05-02 22:58:21","","","","",,,,,6,0.86,1,6,7,"We used the hydrologically corrected Multi-Error-Removed Improved-Terrain Digital Elevation Model at a 3 arc-second (90 m) spatial resolution to derive a seamless …","https://peerj.com/preprints/27109.pdf","https://scholar.google.com/scholar?q=related:s3wDowFsNiEJ:scholar.google.com/&scioq=&hl=en&as_sdt=2005&sciodt=0,5"
0,"A Hamilton, JM Qiu, H Zhang","Scalable Riemann Solvers with the Discontinuous Galerkin Method for Hyperbolic Network Simulation",2023,"Proceedings of the Platform for Advanced …","dl.acm.org","https://dl.acm.org/doi/abs/10.1145/3592979.3593421","",188,"2025-05-02 22:58:21","","10.1145/3592979.3593421","","",,,,,0,0.00,0,3,2,"We develop a set of highly efficient and effective computational algorithms and simulation tools for fluid simulations on a network. The mathematical models are a set of hyperbolic …","https://dl.acm.org/doi/pdf/10.1145/3592979.3593421","https://scholar.google.com/scholar?q=related:L-hmR_t1VmMJ:scholar.google.com/&scioq=&hl=en&as_sdt=2005&sciodt=0,5"
2,"T Zhao, B Minsker","Efficient metamodel approach to handling constraints in nonlinear optimization for drought management",2021,"Journal of Water Resources Planning and …","ascelibrary.org","https://ascelibrary.org/doi/abs/10.1061/(ASCE)WR.1943-5452.0001476","https://scholar.google.com/scholar?cites=7274233435420967848&as_sdt=2005&sciodt=0,5&hl=en",189,"2025-05-02 22:58:21","","10.1061/(ASCE)WR.1943-5452.0001476","","",,,,,2,0.50,1,2,4,"Rapid and informed response is needed to ensure effective water management during droughts, including reliable and immediate data synthesis, near-real-time forecasting, and …","","https://scholar.google.com/scholar?q=related:qEOJ28RE82QJ:scholar.google.com/&scioq=&hl=en&as_sdt=2005&sciodt=0,5"
3,"A Koppa, M Gebremichael, TM Hopson…","A Scalable Earth Observations‐Based Decision Support System for Hydropower Planning in Africa",2021,"JAWRA Journal of …","Wiley Online Library","https://onlinelibrary.wiley.com/doi/abs/10.1111/1752-1688.12914","https://scholar.google.com/scholar?cites=14741429887216836821&as_sdt=2005&sciodt=0,5&hl=en",190,"2025-05-02 22:58:21","","10.1111/1752-1688.12914","","",,,,,3,0.75,1,4,4,"Hydropower is a key part of the increasing shift in power production from nonrenewables to renewable energy. In regions such as Africa, hydropower reservoirs are vital for achieving …","https://onlinelibrary.wiley.com/doi/am-pdf/10.1111/1752-1688.12914","https://scholar.google.com/scholar?q=related:1eDiBGEUlMwJ:scholar.google.com/&scioq=&hl=en&as_sdt=2005&sciodt=0,5"
3,"G Amatulli, T SETHI, L SHEN…","A new and extendable global watershed and stream network delineation using GRASS-GIS",2020,"…","academia.edu","https://www.academia.edu/download/87839204/395090428.pdf#page=219","https://scholar.google.com/scholar?cites=7436231280695920442&as_sdt=2005&sciodt=0,5&hl=en",191,"2025-05-02 22:58:21","PDF","","","",,,,,3,0.60,1,4,5,"We used the hydrologically corrected digital elevation model (DEM)“MERIT Hydro” at a 3 arc-seconds (90 m) spatial resolution to derive a globally seamless, standardised stream …","https://www.academia.edu/download/87839204/395090428.pdf#page=219","https://scholar.google.com/scholar?q=related:OkeHcfPMMmcJ:scholar.google.com/&scioq=&hl=en&as_sdt=2005&sciodt=0,5"
5,"SD Christensen, NR Swain, NL Jones…","A Comprehensive Python Toolkit for Accessing High‐Throughput Computing to Support Large Hydrologic Modeling Tasks",2017,"JAWRA Journal of …","Wiley Online Library","https://onlinelibrary.wiley.com/doi/abs/10.1111/1752-1688.12455","https://scholar.google.com/scholar?cites=2521474875976945412&as_sdt=2005&sciodt=0,5&hl=en",192,"2025-05-02 22:58:21","","10.1111/1752-1688.12455","","",,,,,5,0.63,1,4,8,"Abstract The National Flood Interoperability Experiment (NFIE) was an undertaking that initiated a transformation in national hydrologic forecasting by providing streamflow …","","https://scholar.google.com/scholar?q=related:BI-tVAoU_iIJ:scholar.google.com/&scioq=&hl=en&as_sdt=2005&sciodt=0,5"
8,"LH Meyer","Quantifying the role of agriculture and urbanization in the nitrogen cycle across Texas",2012,"","repositories.lib.utexas.edu","https://repositories.lib.utexas.edu/items/881d6e3a-2a69-4520-a4cf-1a2717c6eef7","https://scholar.google.com/scholar?cites=5827237670242236270&as_sdt=2005&sciodt=0,5&hl=en",193,"2025-05-02 22:58:21","","","","",,,,,8,0.62,8,1,13,"Over-enrichment of nutrients in coastal waters has been a growing problem as population growth has enhanced agricultural and industrial processes. Enhanced nitrogen (N) fluxes …","https://repositories.lib.utexas.edu/bitstreams/fb4dd53f-5d64-4151-b6a8-d251b5a1319e/download","https://scholar.google.com/scholar?q=related:bjeQfMmB3lAJ:scholar.google.com/&scioq=&hl=en&as_sdt=2005&sciodt=0,5"
1,"CH David, V Ravindra, S Nag, A Mehta, Y Sun…","3D-CHESS: Decentralized, Distributed, Dynamic, and Context-aware Heterogeneous Sensor Systems",2022,"","ntrs.nasa.gov","https://ntrs.nasa.gov/citations/20230005750","https://scholar.google.com/scholar?cites=9645860406330473318&as_sdt=2005&sciodt=0,5&hl=en",194,"2025-05-02 22:58:21","","","","",,,,,1,0.33,0,6,3,"This paper describes the objectives and current status of the 3D-CHESS project which aims to demonstrate a new Earth observing strategy based on a context-aware Earth observing …","","https://scholar.google.com/scholar?q=related:ZjtVAO_63IUJ:scholar.google.com/&scioq=&hl=en&as_sdt=2005&sciodt=0,5"
5,"J She, X Li","Map algebra based analysis for directed flow networks",2016,"Transactions in GIS","Wiley Online Library","https://onlinelibrary.wiley.com/doi/abs/10.1111/tgis.12234","https://scholar.google.com/scholar?cites=5740632144940420206&as_sdt=2005&sciodt=0,5&hl=en",195,"2025-05-02 22:58:21","","10.1111/tgis.12234","","",,,,,5,0.56,3,2,9,"Based on the concept of map algebra, this research developed a network neighborhood analysis framework for directed flow networks. The analysis framework has two components …","","https://scholar.google.com/scholar?q=related:bsxcSYXSqk8J:scholar.google.com/&scioq=&hl=en&as_sdt=2005&sciodt=0,5"
3,"PN Gatlin, JL Case, J Srikishen…","The high-impact weather assessment toolkit",2021,"… Observation Science and …","library.oapen.org","https://library.oapen.org/bitstream/handle/20.500.12657/50712/1/978-3-030-73569-2.pdf#page=256","https://scholar.google.com/scholar?cites=10026522196782641784&as_sdt=2005&sciodt=0,5&hl=en",196,"2025-05-02 22:58:21","PDF","","","",,,,,3,0.75,1,4,4,"Of the various types of weather phenomena, thunderstorms produce some of the most immediate and impactful hazards—damaging winds and hail, frequent lightning, and intense …","https://library.oapen.org/bitstream/handle/20.500.12657/50712/1/978-3-030-73569-2.pdf#page=256","https://scholar.google.com/scholar?q=related:eHLMr9BcJYsJ:scholar.google.com/&scioq=&hl=en&as_sdt=2005&sciodt=0,5"
